ID,Rating,clean_review
1,2,Maintenance cost is very high basically some parts are very weak they need to replace in every 10000km running like self bearing and chain sprocket handle racer. It required to service within running of 2500km. As you rise the speed more than 80 km the bike start vibrate and fuel consumption is about.
2,4,Royal enfield classic 350 is a affordable cruising bike with a great mileage of approximately 35 to 40 kmpl. Classic is a very well customization bike good for touring. With pillion removed this bike looks like a bobber which is quite stunning. cons is basically its maintenance should be quite often. Due to its vibration some nuts may loosen which needs to be checked and serviced time to time.
3,4,It's an amazing bike. Riding this bike is a absolute pleasure in the cities . I had few issues with the rear disc and the chain sprocket but after the first service all this issue were solve. One think that disappoints me in this 1.6 lakhs is that it doesn't gets a tubeless tyre and a fuel gauge .
4,4,I have to wait 1month to buy this bike.. Riding experience is good. A little pain in my boom while I rode it above 100kms continuously. It gives a retro look and I love it. Service cost is slightly higher. But I have not face any major issue. Its mileage is 30 to 35. Performance is good.. It can run 80km/h easily.. pros- looks is awesome engine is good. Good mileage though it is 350cc Cons-Vibration is the big issue.
5,4,"This bike is very good and gentle to ride, its full of comfort for long rides.The look of this bike is awesome. Simple design but very classy.It's nice to control. And it's power is also great, with a nice braking stability.But for my purpose it's ground clearance is a bit low though it has 135mm of ground clearance."
6,5,Royal enfield classic 350cc is one of the most comfortable bike. For touring and long journey it is very comfortable. Handling is also good. I love this bike. Maintenance cost is little high but if you ride an enfield then you feel its power and comfort. For off-roading and travelling it is most comfortable bike.
7,4,"The buying experience was great, hospitality of the showroom was very good. The power can be felt while riding.I like the looks of the bike when the rear seat is taken off. Every other things of this bike will never make you bored of. You will always love this bike. My servicing experience is awesome. I will definitely recommend you a classic 350."
8,4,"1.Give you a great mileage 2.Be an easy to repair bike if u find yourself stranded somewhere in the middle of a highway 3. Epitomise the idea of bike featuring excellent quality 4.The loud thunder, the ultra loud horn and the even louder looks, are bound to attract attention on road. And trust me, you will love it."
9,5,Riding experience..The only first in class with royal looks bike is royal enfield classic 350.. Wow its siting position is awesome and comfort doesn't matches with any bike.. All over the bike is build for the toughest Indian roadways...The best bike for long journeys as well as for city use.. Dual disc segment could have been changed to a single disc option..
10,4,"I bought the bike back in 2015 and rode around 40k kms till date, the riding experience is excellent for long drive, but this bike is definitely not for city ride. The mileage is quite good for the relaxation that felt during riding.Taking all round experience, the bike is really comfortable for long ride."
11,5,"Royal enfield looks very royal and it gives a very dashing and a glorious look ,when anyone ride it the enfield and the person seems to be king and enfield seems to be the horse.I recommend all our Indian brothers to buy a enfield but not below 18. Moreover enfield is very safe due to its side guards ,i have experience .Its too good."
12,5,Maintenance cost is very high basically some parts are very weak they need to replace in every 10000km running like self bearing and chain sprocket handle racer. It required to service within running of 2500km. As you rise the speed more than 80 km the bike start vibrat...
13,5,"The bike may be costly but its performance is high.. Feels very relaxing while riding it.. So comfortable.. But the mileage is low that is the only disadvantage.. Otherwise it is a perfect bike..It has got a thrilling sound, it is so fascinating.. Wonderful bike..Feels like as if i am riding a monster bike.."
14,5,"I own this bike from past 2 years . The maintenance cost is average and it has excellent riding comfort. I have not found any issue from the time when i bought this bike. I am shocked that people say that its not good bike cannot go fast .. I know it vibrates at 80 kmph but this bike is not like others .... Its not just a bike ..It is more then a bike... I saw that people compare this bike with ktm or other bikes having 300 cc engine and above , this bike is not like those bikes ... Its a retro , not a racing bike. All owners think that my bike is perfect than others... I am not saying its a good bike because i own this bike.. I am astonished that people say that .... Ye tezz nahi chalta hai .... And many more this bike is not made to drive fast ..... It was made to provide better riding comfort for long rides ....People think that its a 350cc bike and it cannot win race with even 200cc bike .... It is not made for racing guys .."
15,5,Its a great bike. Delivers the feel of a gun. Its a heavy duty and a legendary bike. Comfortable for the rider and the pillion. It got a most sophisticated riding position. The bike is easy to handle while riding and the suspension is great. The maintenance is great and the service center are very helpful.
16,4,"Being a cruiser bike fan i didn't have much option to buy other bikes than royal enfield, the service manager was helpful while buying, buying experience was very well and excited for royal enfield  Riding experience is good as no other bikes can give the feeling that royal enfield gives, very comfortable to ride on any condition of toad  The looks of royal enfield is heart stealing, and the performance of bike is damn good,  Servicing the bike for first time for me was good, but after the first service the mileage of bike is improved, the maintenance of bike depends on the rider, how he keeps his bike clean and safe  Pros - Beautiful looks, Loud horn, Silencer sounds is unique among all other bikes, Comfortable seat, Hugh powered engine, Whole body metal  Cons - Very high weight, Vibration start on reaching 80kmpl above, No fuel meter, No tubeless tyres, No alloy wheels"
17,5,"I love royal enfield. My most favourite bike is royal.I also have a gun metal gray. When i riding on my bike feel like god.This is my dream bike.And i love the royal enfield showroom.And there service. All employees are very nice and good.When training in this bike,you feel a great moment.I love this."
18,4,"1. Buying experience is good and showrooms are very neatly decorated. 2. At seeing the bike you'll feel like you can't ride this , it weighs 192kgs, it will be difficult to maneuver. But the reality check is it's super easy to ride, handlebars feel light when you ride it and pickup is also very punchy and it feels light on his feet. 3. It's having a timeless design and a charm which attracts people and while it uses a very similar type old-school twin spark carburettor single cylinder engine there is abundant of torque on offer and power for daily commutes and occasional highway rides. 4. Service experience is not that good because when you tell them some issue is there in the bike then sometimes they say you that it is a factory fault and we can't do anything. Pros : 1. Timeless design and nicely themed showrooms. 2. Good for daily commutes due to abundant presence of torque. 3. Very light and easy to maneuver. It's just a matter of time for getting used to it. Only in standstill you'll feel the weight. 4."
19,5,"The bike is very good.The riding quality is so comfortable for long riding.And also the mileage is so beautiful,and the power is so good.And the service experiences are awesome.Royal enfield is a trusted company and bikes r so good."
20,4,I use enfilade 350 classic. It's a amazing looking bike and strong than others. It gives 35 km mileage . When i ride it on 110 km / h it's not vibrate but other bikes vibrates . It's a good bike for long tour . I think 350 is good than 500 cc because 350 gives better mileage .All enfilade user feel proud because they use enfield. I am so proud . It's not a bike it's a tiger
21,5,Buying experience is best . My dream bike.To royal.It fell like royal. It has low maintenance.It's is super good bike.It's good experience. It's servicing cost is low.It's is very strong bike. Bike has good looking tyre. Alloy wheels....Headlight.... Front disc brake and back disc brake are too smooth.
22,5,One of the best bike i have ever bought riding it from past 2 year and don't have much problem i just do regular service at 3000 kms and fill fuel nothing else no problem or any huge maintenance cost just buy it no problem but only if you can take care of this beast and i easily gets mileage of 35-40 in city which is good enough.
23,5,I was founding some powerful bike under 350 cc segment then i found royal enfield 350 classic which has bold look and whole metal design. Riding experience is like royal people. Bold look feels heavy and good performance as 350 cc bike segment. Less maintenance or maintenance free bike. Service quality of this bike is good Pros.. Easy to control on road. Cons.. Heavy.
24,4,"I'm have been using classic 350 since june 2015. It's a great bike. I'm getting around 40 kmpl mileage, which is brilliant i think. The only issue i'm having is the rusting of the various areas. I think every biker have a dream of owning a royal enfield and every biker should once ride a royal enfield."
25,5,It is very comfortable ...You can use it for long journey but don't think it is sporty But it will give you more comfort. I have bought it 2 yr before everything is ok only sometimes i feel top seed should be increased.At the service center there are trained staff you will not face any problem Maintenance of bike is little bit high but not as much so that you cant afford.
26,5,I owned classic 350 from 2016 and i feel blessed that these types of bike i have. It's controlling is excellent and most importantly when i ride it for long tour it's helpful in jerking it's shocker is superficial.I can't explain in words that this bike give comfort to me.Looks are not well but good .I am happy on owning this bike.Thanks for giving me opportunity to talk about my rowdy my classic.
27,5,"New re classic 350 riding quality is amazing and abs is working great while riding, i always think its have clear fuel gauge meter. Current fuel gauge can not identify that's how much fuel in tank. For average height rider have high low seating position adjustment in bike. And by the way classic is amazing riding quality. I am talking about new classic 350."
28,5,"Hi friends, my one friend has this bike i once drove this bike i felt so happy and i was just feeling very happy and confused that it was a bike or a cloud It was just gorgeous and i felt that i cannot control my self a some tears also came I was a royal enfield user before 20 years but these years i was riding different bikes And re has refined its engine also."
29,5,"Royal enfield is the best bike for me and also lucky because this bike give me a service in a big company so i think it's lucky for me, and also my friend buy a royal enfield thunderbird it's good but my its better than friend. I am looking a macho look with my royal enfield classic 350 best colour with green so i am happy with my great bike."
30,4,Royal enfield is always the first and best choice among the youth..I have a fantasy of this bike since my childhood.. Bullet is something which feels as power and pride.My father had gifted me classic 350.As a equal right of both of us..Riding bullet is always a dream for me..As in reality it is far much better..The sound the seat is something which is very difficult from all other bikes available in market in this range.I bought it in colour of red and black..Which i think is best suited on me and my bullet.. It has a best mileage of 45 kmpl..Its looks is very attractive and in red it is on its peaks..Very bright head lamp and comfortable seats very nice ground clearance and large spoke wheels..Gives you the best riding experience of all time... It's service and parts are not costly at all..Very nice and friendly tech and support team is always available for you bullet ..And the service centre is also very co operative and value your time and money.This is not all . There is far much more thing which royal
31,5,"I bought this bike from kolkata just before the lockdown for my daily office journey. It's classic 350. Red in colour. It's giving really a royal feeling. Red and black combination is my favorite also. I bought this bike for it's killer look and royal feeling with a good performance. I modified my dream bike with extra 40k. Then, it's become more killer at its look."
32,4,If you are looking for modern features then enfield is not for you. You will not get a digital instrument cluster neither usd fork not even a slipper clutch. Enfield is clearly a emotion a status but the build quality is extremely good. You can't go for a race but you can go for a long tour. So think wisely. If you are looking for a high performance bike don't go with this but if you are looking for a comfortable and royal ride go for enfield. I hope this will help.
33,1,I'm very excited to buy royal enfield main road a few months later the service quality is very poor and their exist very vibration when i go to service center they cannot solve my problem and the mileage is very bad no power to 350cc actually this is very bad bike also and the maintenance charge is affinity cosplay and the performance is not very good. Breaking is very bad light illumination is not good a night you do not see the road in night anti braking feed rate is very very very bad yamaha bike is very very very good company find a hero honda i suggest to not speak to the royal enfield classic 350 or thunderbird 350 you can go to buy yamaha fz25 bs6 fzs25 bs6.
34,4,"buying experience is very good,riding experience is too good,looks is awesome,performance is very good,but millage is bad,service is good,if you re buying a royal enfield you have to maintain it, pros: 1. looks 2. performance 3.durability 4.comfort cons: 1. mileage 2. maintenance in 1 word you are buying a most loved machine,so you have to take care of it."
35,4,"If i talk about pros then those are endless but cons are little so cons are: since this bike has been attracting both young and elderly peeps so 1st for young peeps: you won't feel the punch in acceleration like your life's having right now, its a butter smooth motorcycle 2nd for the elderly men: might give you spondylosis coz of the vibration bit it can be eliminated if you get an aftermarket handle bar. 3rd Its for both as it still lacks many digital mechanism but at the same point if you think of the name i.e Classic then i hope it won't matter.. by design it maybe classic but in riding it will give you a modern feel."
36,5,"Bought this towards january end in 2020. Showrooms were running out of stock when i heard from one that bs-iv was still available with them. Was not interested in bs-vi because the price differential seemed unjustified at that time and still does. Wanted to buy re for a few reasons - i) father's dream to own an re since childhood ii) retro styling and riding comfort was like none other iii) road safety due to the weight being on the heavier side(yes it is quite heavy for a first rider to manage a ~200 kg bike). Went to the showroom to get a bullet electra but found out that they still had a bs-iv classic left. Considering the fat back tire and better seats, it was a no-brainer that classic was to be the obvious choice.Read a lot of reviews before buying, found both positive and negatives, occasionally dropped the idea of buying this bike(based on reviews) as getting this monster was not a necessity but a luxury. It was not a practical purchase as our commutes are usually taken care of through cars. Yes, the"
37,5,"It was very good bike in classic style. riding experience is good and keen to killer looks. low maintenance cost. Disappointed by its vibration, when you ride the bike on 120 kmph. its not racing bike, it is a classic bike that you ride upto 40-70. in city mileage is 33 and on highway mileage is 38. mileage totally depend on your riding style. Overall its good bike for daily use."
38,5,"Superb bike i like it to much my dream.Now m going to purchase this from kolkata .Superb puck up , easy to handle , easy to drive also . So' please guy's purchase this bike and feel like king on the road .Maintenance is little bit high but we can handle it to take this type of enjoyment."
39,5,"classic is one of the best looking motorcycle in India. performance is ok of its riding, you can never expect agility of a naked sports bike and a pickup of a fairing bike (sports bike).... If u r looking for a bike which you want to ride it on weekends rides and go for a long drive then its is the Best bike for u..."
40,5,"1.You have to book it before 1 week 2.Riding experience is awesome.Feel like king.But after 65km speed vibration appears.3.Average 32-35 km, performance is really amazing, little bit heavy.4.Service cost is medium approx 1500-2000.5. Pros: comfortable, easy to maintain,new model has minimum sound.Cons: vibration, mirror vibrates, back kick is so much powerful."
41,4,"I bought it this year and really loving it, if u are thinking for a bike for town ride then this may be your bike.Till now i have traveled 700 km in this bike and really it's awesome.Pros :1.It is comfortable, 2.It gives u a royal look, 3.The sound gives u a sense of power that the engine releases ,4.Color options are available, 4.Full metal, 5.Shiny look (if maintained properly), 6.Mileage is also good. Cons:1.Too much weight, 2.Price is little bit higher than standard version of this, 3.Rusting( if not maintained properly), 4.No digital meter, 5.No fuel gauge, 6.Vibration."
42,5,Classic 350 is an awesome bike and also good for city.. Its feel is premium like you ride a lion.. Performance is good and looks are like king of all bikes.. Servicing and maintenance are not much easy as it is very expensive but still they are expensive but will get assured quality work.. pros :1. Suitable for city ride and hilly areas 2.Comfortable seats 3.Great quality materials used cons:1.Back break always loosens very quickly 2.Needs maintenance quickly before time 3.A bit heavy.
43,5,"1- royal enfield salesman behavior is very friendly.2- and this bike riding is feel light and very confident. 3- this bike look present very massive and macho, road presentation look very good and different in crowd, this bike performance is not very well but i am happy with that performance due to that is do not made of drag race or speed, this is made for cruising, 4- servicing and maintenance is not going so high and not a low it's affordable or nominal,royal enfield is a passionate bike for me . That's why i will happily afford that nominal maintenance and servicing charge due to maintain.5- this pros and con is like instrument console limited wheels tyre,battery not maintenance free it's can be better good thing is : body balance and fully mattel body, alight look trusted brand and trusted engine durability body parts essly availability."
44,5,"Pros:1)when it is on above 80km/hr then your are a king on road.2) the minimum noise of original silencer.3) this is a heavy bike,so much stable.4) comfortable seat.5)enjoy long journey with this bike.Cons:1)no fuel meter. 2)mirror vibrates bellow speed 45.3)engine heats in less time.My king is my royal enfield."
45,5,"Riding experience is too good. I have completed 600 kilometres within 2 days and the mileage was too good that was unexpected for me. Really classic 350 overall a good looking bike of bike industry because it is a vintage look bike and also i like that look. If i am talking about suspensions, that really very good performed on off-road and on-road. Also carrying capacity, balance, noise everything can under your expectation."
46,1,"I had a classic 350cc royal enfield which i already sold, very low pickup, can buy a r15 instead of wasting money on royal enfield. It looks like a 1970's bike. Looks like a duffer. No modern sports design, stupid oil tank just look like a fat person tummy. Engine sounds is too stupid, the sleeping dogs starts barking .. Fat body design just like a hyphopotenous. A guy passing behind you with a pulsar 220 or any other commuter or sports bike looks more smart. The pillion position seat same looking like a auto rickshaw front seat. Better royal should manufactured auto rickshaw rather than motorcycle. It suits it's company status like a auto rickshaw manufacturers. The fuck 350 cc engine is so slow that any one can overtake it with a 180cc pulsar or apache rtr. Every time when i sit at pillion seat of the bike, i feel i am sitting in front seat of rickshaw. Guys don't waste your money by purchasing royal enfield, it's not 1970's. Now 2018."
47,5,Awesome bike for Indian conditions. Look no further if you are into buying a classic looking bike in the 350 segment... Great bike.....Looks are gorgeous. The ride quality is majestic for this price point on Indian territory.Take you back into a era and gives you a wonderful feeling of royalty that used to be of old.
48,4,Buying experience was not that good enough because in silchar classic 350 is in high demand so you have to wait (q) .While riding i feel like i am the one an only boss on the road.Looks that i don't need to say everybody knows that very well. (awesome) while i ride the bike near market area everybody stare at me and my bike.Performance is at its best One an only cons is fuel efficiency. But due to 350cc engine you can't see that as a cons.
49,5,"It's get to feel us like i am the royal and a king, a very good experience to ride it, it is the most amazing and good looking bike i had ever bought, it's performance is so good, mileage is also awesome, the servicing of the bike is very good and the maintenance cost is also not so high that anyone can't afford."
50,5,First of all this bike is very useful for me as i am using it as daily commuter bike and i am riding it since eight months. This bike has powerful and fuel efficient engine as i am talking about bsiv model as i have gun grey classic 350cc. And its very good ride in hill and terrain area like sikkim north east India..Very good fr go long ride. Its giving me 32km mileage right now which is satisfied for me.I had booked this bike on 25th of Nov 2017 and re showroom siliguri 2nd mile sevoke road delivered this bike after 42 days of booking i.E on 4th Jan 2018 it was new gift for new year. I had done 1st service at same showroom and service was good and riding is smooth till now no problem...Guys who really wants to feel like riding a bike which have powerful engine thump and comfortable seating posture straightly go for it. No matter whoever call it haathi(elephant) cause it has extra identity and respect.
51,5,“royal enfield” The legend of motorcycles Buying experience-wonderful Riding experience-when i ride my re i feel i am the king..Looks-a machine..And re classic 350 is looks like a young man in re generations.Performance- a1 Servicing-depends upon on your riding style..But it comfortable to maintain I love classic 350 more than anything else..My first and last love classic 350.
52,5,"Buying RE is always the best experience. As it is a cruise bike not a racing, so don't race with it else you will not be able to enjoy the cruise riding. It is the best when you are at about 50-60 kmph. Looks are totally different when you remove the pillion saddle, as I did in my Classic...try it for watching more people at your RE Classic...."
53,4,"The buying experience was great, i bought it with emi option for a tenure of 36 months.The bike ride is great for both daily commute and off roading. The looks of bike is much better than its electra model but i wish it had the same tank as of re bullet standard which has 3d engraving and painted with hands.Maintenance cost is somewhat higher than other bikes but it deserves that attention and care.The only con is the gearbox, sometimes gears box confuses me, leaving that the whole bike is great and worthy of riding."
54,5,"1.You have to book it before 1 week 2.Riding experience is awesome.Feel like king.But after 65km speed vibration appears.3.Average 32-35 km, performance is really amazing, little bit heavy.4.Service cost is medium approx 1500-2000.5. Pros: comfortable, easy to maintain,new model has minimum sound.Cons: vibration, mirror vibrates, back kick is so much powerful."
