ID,Rating,clean_review
213,5,Good bike...Never had a serious problem with the bike..And ya....It really gives u royal feeling...Mileage maximum i got on highway is 52kmpl..But it varies a lot according to your riding(but never below 42kmpl).This bike is not for top speed.If u want speed then go for other bikes..Around 80-90ph it starts vibrating.But not much uncomfortable...And guys i don't think we go beyond 80kmph in cities...On highway also 70-80kmph is good and safe speed.Riding posture is good but you need to add some sponge in seat for more comfort if u do long rides like above 150kms or so(or your pelvic area will get numb) and for pillion add the back rest like tb as pillion seat is not comfortable for long rides.Overall if u do seating comfortable by adding cushioning(for long rides of more than 150kms only) its perfect bike. For city riding the bike is best. Easily controllable.
214,3,Pros 1. Excellent ride quality 2. Feel the power 3. Easy maintenance 4. Feel like king 5. Great pick up Not any bike below 3 lakhs can match this beast. Cons 1. Lots of vibration 2. Buying is headache 3. Shaking above 100km/hr 4. Self start is pathetic 5. Cheap quality parts But anyway i love my r.E. So much.
215,5,1-buying a royal enfield bike is bit tough process as it take 30-40 days to deliver the bike after order 2-there are no words for riding experience as the enfield is a pleasure rather than a bike 3-performance is very good but little slow pick up and it's classic look asked you buy it at it's first glance but there are some antique things in bike to be changed 4-servicing is affordable and there are n number of service centres across the country 5-pros:*awesome riding posture*comfortable seating*vintage feel*heavy torque*off road compatible Cons:*low power*absence of fuel gauge*poor safety features
216,5,Good bike for long ride and safe ride and i wish one day i ride with bike form my house to leh-ladakh with my friend the bike sound is very good and bike weight is also good so bike is good for highway and long ride and the bike is good class and we want the any how and engine is good i love this bike
217,3,my dream bike classic 350 i got it.but riding experience very worst i feel it. really looks is awesome performance 80 klm speed is better.more than noise problem I'm disappointed.service experience very bad. first 400 kilometer reached clutch plate damaged not moved bike.not claimed bike charge.gear shifting problem.automatic 1st geared moved bike. i am really i thought irritating service experience very very bad.
218,1,Service station not good.Riding experience very bad when attended 100 kph i feel more vibration .I am disappointed with pillion seat which is not comfortable leg is paining after you reach 50 km .Braking is not bad but after 500km you need to retain brake or tight .When u start the engine often terrible sound arise or come so on
219,5,I was founding some powerful bike under 350 cc segment then i found royal enfield 350 classic which has bold look and whole metal design. Riding experience is like royal people. Bold look feels heavy and good performance as 350 cc bike segment. Less maintenance or maintenance free bike. Service quality of this bike is good Pros.. Easy to control on road. Cons.. Heavy.
220,5,It is very hard and branded bike everyone know. I have won this bike upto 6 months it is very good bike of all time. I have riding this bike everyday at every occasion. The riding position is very good it's comfortable relaxing and reliable. I have installed dolphin exhaust for best loud sound. I have owned classic 350 gunmetal gray..It was look unique and be royal.This bikes maintenance low and charges higher but effortable.In highway for best riding experience.. And offroad riding is so smooth and comfortable.. This bikes disadvantages is its weight in traffic i face many troubles and parking place.. Bt its a awesome bike at this price range.
221,3,"Worst buying experience  Riding experience is not so great  No fuel meter is a setback  Worst services  If you park your bike in rain it won't start because of poor built quality overall i'm not satisfied with the bike chain sprocket is also worst better go for some other bike. Not worth for money, waiting period is also high"
222,5,"1. Buying experience was average and could be more improved. Royal enfield server is generally always down and i waited 2 hours to collect all the documents but this need to be improved for better buying experience 2. Riding experience is good as so far i have driven around 500km and have to go for the first service. But during last one month mine side stand sensor stopped working. Other things are fine and i am getting around 30-32 kmpl mileage, though using the shell petrol. I will give some more update after 1st service 3. Looks are awesome and performance is good for a smooth ride or around 60-70km.. I didn't drive more than 60 considering new machine.4. Will update after the first service done5. Pros: good looks, comfortable ride , very easy to handle while driving. Cons: poor electronics but royal enfield is not meant for that.."
223,3,"I got mad about these bullet family so i choose classic 350. But it’s a lot of complaints my money was loose many many problem . Looks and performance are good. Riding experience good. Service and maintenance are too coast. Classic is useful for citizens . I am a youngster so so my vision about classic is so bad but royal enifiled himalayan , gt interceptor is ok for us."
224,5,"The royal enfield classic 350 is the perfect motorcycle for a beginner or for anyone wanting to get back on a bike after many years of driving.At only 412 pounds, it is an easy motorcycle to grab hold of, easy to sit on, easy to operate and there’s not nearly enough horsepower to get you in any trouble. It’s the perfect conveyance for all those “rides of gentlemen” where everybody wears vests, mustache wax and monocles. It is comfortable and as high pickup but maintenance is some what costly remaining it is completely perfect."
225,5,"I was no heading before i had royal enfield classic . I had first driven this bike really i feel awesome and feel like royal . Now i had ride 2500 kms my bike its overall feedback is so good to my knowledge , i would like to recommend all of you if your budget is more than 1.5 Lakh then you should purchase this royal enfield classic 350 ."
226,4,"Classic 350 is a intimate motor for bike lovers. It is noteworthy for revealing classic insights of my moments with the bike. The bike classic have a chronicling experience which have transformed it to a notable and trustworthy bike in hearts of Indians. While describing the riding moments, one get impression of ecstasy driving. I have taken a complete research in buying a motor. Bullet had satisfied my right decision to choose it. Looks and performances are wonderful but hoping new innovation as those in premium bikes. Although the bike provides much stability service and maintenance are quite high as compared to other bikes. The quality of bike does not permit one to any negative comments. Bullet is deeply personal bike with its soul and substance. It inspires to take plunge despite all obstacles and to 'be liberal in our riding moments'Everything does not provide quality but bullet provides quality. It is like a gun and moves like a bullet."
227,5,I love this bike so much.This bike is comfortable.When i saw him first time i desperately wanted this bike.This bike has a good riding experience with me.This is the best bike.This bike has its own look which makes it perfect bike.This bike has a good maintaining of sevicing. I preferred to use the royal enfield bike because it is the one of the best bike.
228,5,This is an amazing bike which has an super powered engine which i was owned from last 1 yr this is very good and condition of this vehicle i maintain perfectly really awesome bike this was i have ever seen in India and i am very lucky about using this vehicle this bike made me feel very royal and very comfortable.
229,5,"It's an amazing bike for normal users...Not harsh riders, this is a cruise bike and it can go on a cruise speed of 80 at ease,and using it till 2015 has given a good experience...There were some complaints made by myself on some stupid movements...After all this bike is an excellent choice for a cruise rider,and i am damn sure riding this bike is really comfortable and there are no body pain in riding this bike for too long..And i am happy for buying this."
230,5,"I learnt to ride on an old bullet 350 with a right side gearshift and neutral box! and i found it incredibly hard at first. Then my dad bought a honda unicorn (which is quite heavy for a 150cc bike) and i loved the riding experience on it.A couple of years later i bought a thunderbird 350cc and i found it even easier to ride than the unicorn. The bike is quite heavy but the centre of gravity is much lower and hence it is easier to handle. In terms of braking, it has a dual-disc brake system which has not failed me yet since 2016. The only issue i have faced is vibrations when you cross 100kmph of the highways…wear good leather gloves, and that is dealt with easily."
231,4,"Didn’t get the desired colour and takes much time for delivery. Riding is good, Looks are brilliant, Performance is good. Service and maintenance is not bad. Build quality is not so good. I got the 350 signals model the silencer got rusted and paint is also removing(black). Silencer doesn’t sound good And it’s little expensive."
232,5,I bought it on 10th june 2018 it's a muscle bullet with max torque and power carry 346cc this ride is very powerful it's performance is better if you don't change silencer and other spare parts of bullet..... Service is awesome they do service in 90min there are not a single cons in this muscle pros are 1. Max power 2. Max torque 3. Best mileage 4. Very comfortable 5. Best for long cruise..... Max speed is 129km/h.
233,5,1 i had bought the bike with out gst at low when compared to now. It is worthy for our money. Excellent bike  2 very comfortable i am loving it  3 stylish and mind blowing a king only can ride a re the feeling i had got  4 superb and excellent response to the service center itself now also  5 very good. Awesome
234,5,"Royal enfield is always been in my wish list . I really feel very proud in riding this bike . I feel like a superhero whenever i ride it. Easy to handle .This is a dream bike for me . Highlights: low cost , maintenance, powerful engine , unique look , easy to handle , i would really love to have it in my collection."
235,5,"I have bought bike in 2015 , waiting period was 6 months , at that time it was in very demand but i got bike after 8 months after booking & riding experience is very good if we use gold star exhaust the pick-up is very good & even top speed also increases but the mileage decrease . My bike mileage decreased to 33kmpl from 40kmpl Look of bike i very good if you maintain it properly. Servicing is not much high...Built quality is very good ....Once I met with accident not even a dent."
236,4,"For us guys who have the passion of riding bikes. All that comes to our mind are bikes manufactured by big companies like harley davidson, kawasaki, ducati and much more. But all of us are not fortunate enough to ride those big names. So we stick to our budget for the best available options. Royal enfield did not disappoint when it comes to budget for a dream of riders passion. Well performing bikes for affordable values. Classic 350 has a good mileage for a 350cc bike as well as satisfy the overall riding experience for people who look to ride for freedom and joy. And yes, sometimes even when you thirst for adrenaline it gives you speedy riding experience too. I would love to recommend royal enfield classic 350 for people like me who don't have the budget for a big bikes.. Its worth every penny.. Ride till i die.. Peace out."
237,3,My buying experience was good but there are certain things that needs to be worked out by royal enfield in terms of keeping a check on their dealers for eg when i purchased my bike the dealer insisted that we have to buy the helmet with the bike as is it mandatory. Frankly this makes no sense if one already has a helmet why will he buy another.  Pros: though it is a heavy bike you don't feel the weight when riding.  Mileage is also good  You don't feel the engine heat  Cons: poor braking  Poor material quality
238,5,I found the bullet classic 350 very awesome..It was great experience taking the test ride...Looks are very impressive..Servicing and maintenance..Are too good.I would suggest it to others also ..Its looks are killer. .It feels as if a king taking a ride on a beast...It sounds like a roaring lion .....
239,4,A bike that is brought with your heart not with your mind at a price where bikes come with the all the elections upholstery on the platter this beast socks to the basics  once you start the bike the thump and the vibrations welcome you with open arms. Start cruising and the bike feels at home 70 to 90kmph is a sweet spot for the bike but exceed the 110 kmph mark and you know that is out of its element . This classic thomper isn't meant to record 0-60 kmph times or raging the highways with a zap.  But yeah the vibrations when they creep to t handle arms it makes the rear view mirror it makes it almost impossible to see what's behind you .  So all in all its a bike to buy with your heart and the list of cons so here they are  1. The lack of a fuel gauge  2. No abs even though the high price of the bike  3. The vibrations that make r ear visibility almost impossible  4. A little refinement will do wonders on those long highways  so here's the review of my classic 350 and its a beast that is practical too in a s
240,3,"I bought this bike 2011 when it had a waiting period of 6+ months in bangalore. So, i bought it from my home town kharagpur, west bengal & transported. Then from bangalore to delhi and delhi to my home town i had journey with this bull almost a decade. Very good for long journey, not for daily commute. Also need periodic maintenance to alive this. Service cost is bit high. Vibration is there on 100+.But on a long highway while it actually burnt and other bikes are exhausted this ride will feel like a feather and runs infinite."
241,5,best two wheeler with best pickup on highway it goes up to 120km/h without any difficulty and can go up to 140km/hr. This bike is not suitable for a person with weak structure because the pull in 2nd gear towards backward is marvelous but unfortunately service center are disappointing and charges money without service.
242,5,"don't you ever call it a bike to the person who owns one! it is not a bike, it is addiction and passion. This beast is actually a feast for a rider. They say once you ride a bullet, you will never ride any other bike. Bullet is one of the productions India is proud of and exports to other countries across the globe. Thank you royal enfield"
243,5,"Yes one of most buying bike(beast) in India .With outstanding looks & engine ,it is a dream of many people in India to buy bullet and went to a tour of ladakh with our best friend or with our sole-mates .It is my dream also to have one of the bullet ( beast) & went to a tour with my best friend i will personally rate 110 from 100."
244,3,"Buying experience was great and riding experience is the best biking experience ever its the best bike for long route riders. The looks are old is gold type looks and yes its excellent, the only thing which is not so good is the maintenance cost it took 4-6 thousand rupees for a servicing after every 2-3 months gap if you ride only in the city then also if u kept it covered for a month then also, now you think how much it will cost after you ride for a long ride. It's excellent bike performance mileage and all but the only problem is the maintenance and servicing issue if you're ok with that go for it its the best. Thank you"
245,5,"The beast..! I love to ride this bike..!  We don't get bored riding this bike even for long hours..! It is the best bike which can be used for a long drive..! Every other bike should clear the way when a enfield moves on..!No bike can stand within this beast..!  Its power,its performance,its look.., Everything is just awesome..!"
246,5,"My royal enfield so good, i love my bike, its performance is so good, i have maintaining it from 6 months, i loved that bike i have red colour bike and i have modified it the best thing i love is the sound in it."
247,4,Royal enfield not give good average .It consume large amount of petrol than other bikes .Royal enfield also good for long tour like some riders use for leh trip or shimla trip.It is also good because it have good grip of tyres .Royal enfield look royal on people who have beard and good height and personality.
248,5,It is very nice to ride for long distance no any back pain and no any other problems. Gunmetal colour is looks so good.Compared to some other bikes like java and something it is too good and noise can be filtered.We can drive it for 60 to 80 gives good mileage also and upto 40kmpl price must be also normal
249,5,Royal enfield classic 350 is a royal and amazing bike. According to my experience its worthy in price. I am giving always priority to classic 350 among all the bikes. I am suggesting my all of the friends to go to royal enfield classic 350 ride once and experience a great journey.
250,5,"Buying was much easy and service was satisfying with available nearby maintenance centres. Riding on it is so amazing in every road whether highways or rural and gives an pure trendy and royal look .It's performance is undoubtedly thrilling and very good.It's looks royal and classical and service is much easier and rapid. It's an all-rounder bike for every moment of your life in ceremony,party and daily work. It's awesome......."
251,5,It's waiting period of 6 to 7 months. But it's ok for royal enfield i can wait for .The day when i got this bull i was really feeling the king of the road. And the next day i went to daman ride with my wife.She got no idea regarding bikes but she reply me that it's like a machine. Maintenance also not so high as compare to other company higher cc bikes.
252,4,Actually the one thing i hate in my bike is that the gears are to be tapped/shifted twice or else the bike gives a jerk.There is no fuel indicator in my model. The bike's keyhole has a nut in it's surrounding and that will be loose after few days.It has a good braking system and if overused you may fall.Amazing bike for respect expectorant..But anyways i love my bike.........
253,4,"It is good in comfort and riding position.Only this bike has only one problem that the engine gets cool down easily.This bike is not going with tubeless option in its wheel.What if if you are going to some important work and then it got punctured,due to its heavy weight you can't walk also with this bike for 1km by pushing it."
254,3,"Well the buying experience with this bike was very good just like almost all the other brands. The staff is very good at the dealership that I bought the bike. The servicing is on the expensive side but it's worth it. They service it very well. The only positive about this bike is the looks. The riding position is very comfortable but the overall ride isn't. Especially the vibrations that are felt everywhere. And the pillion seat is the worst. If the ride is more than 15kms don't even think about taking a pillion as the amount of vibrations on the pillion seat are more than enough to make your body go numb. The engine has quite good amount of torque but lacks in terms of power and top speed. Cruising Speed of this bike is 60kmph. More than that and be ready for numb hands. The handling is very bad, as in maneuverability is bad. Heavy bike for traffic. Mileage is not more than 45kmpl that too if you ride it sanely. And during monsoon rusting is the biggest problem. I did once get stranded because the electric"
255,4,I ride this legendary bullet its was fell like i am trip on any type of air craft its sound like that helicopter and its was good posture to ride this amazing its best for long ride but its have a some common terms mistake who people buy royal enfield 1.5k to 1.9 k spend its dint get fuel indication on royal enfield classic 350 so its good but on those amount atleast royal enfield give fuel meter its humble request for re company.
256,5,"Buying experience is very good i did not face any difficulty to buy bike and ridding experience is awesome his when you ride this than you feel it how bike is about the performance and look, you can also see the look of bike look is very good in cruise bike and service and performances; this is good there many service centre of royal enfield and service cost is low and lots of thing are there to say."
257,4,"Buying experience is good, ride a bike as you love yourself that can be maintained your riding standard, people look and said wow what a bike that because how you maintain as a handsome bike for a future performance you can servicing after 5000km and every month you'll check your bike mobil, colin water, brake oil etc."
258,5,Its only enfield that makes me feel proud while riding my enfield rather than riding any other bike..Its comfortable for me in any situation..I experienced great performance since last 3 years..I recommend all the viewers to try this bike out on the road...Coz it have quite less maintenance than other 350cc bikes.
259,5,"1.It was too good. My dream bike now is with me after 5 yrs. Emotions are attached with her 2.Feel good with every ride from bottom of the 3.She is very beautiful, very good performance 4.Servicing experience is good. No much more maintenance while regular service 5.Pros.It has powerful engine Cons.Fuel gauge."
260,5,M a madly into royal enfield.. Specially your military colour.. As the part of force member.. We already having royal enfield in our campus.. So whenever i need to travel in border area i always prefer royal enfield instead of our maruti gypsy.. As you already border roads are rarely maintained and some of our border out post is in heel area.. So normally bike needs power and comfort.. And all these qualities given by royal enfield classic with their Hercules look.. As we having already a branch of vehicles so servicing and maintenance is not an issue.. Now i am planning to buy same bike for myself so that whenever i will go to leave.. I will ride my own #royalenfieldclassic350.
261,5,"It's really awesome bike and good for those are looking for passion. Adventures bike. Good to buy. Feeling good after buy. Mileage is good. Good self, Good tyre, Good headlight, Hunk bike. Feeling good. Recommended to my friends to buy. Again planning to buy for by brother. Heavy weight while riding very smooth. Does not matter you are taller or shorter."
262,2,Maintenance cost is very high basically some parts are very weak they need to replace in every 10000km running like self bearing and chain sprocket handle racer. It required to service within running of 2500km. As you rise the speed more than 80 km the bike start vibrate and fuel consumption is about.
263,4,Fantastic bike to ride and it has glamour of looking different from other bikes. When you ride this bike you feeling of king will come as in it name already there royal that feeling will come. I have brought my bike last year and it has been 1 year i m enjoying riding it nothing has happen to it....
264,5,"when I bought classic 350 bs6 model is very good it is best bike for tours the sound is very good I bought red colour the riding style is very good performance is super my opinion is good bike so you can buy this bike, when you ride bullet you will feel like a bullet rider, bullet is an style bike and wonderful bike."
265,5,"I bought royal enfield classic-350 after overall wait of 1 month from the booking date. Mine one year ownership is awesome only with slight general repairs. When my odo turned 15,000km i got my service billing amount around ?6,000 that’s the only thing i felt bad! except the maintenance charges bike is awesome!  Handle moment and vibration must be manage a lit more"
266,5,This bike was my childhood crush when i finally got it that was the best feeling .... :).. I am in love with it no matter what. Long rides or small make me feel comfortable .. Riding it makes me feel awesome...:) this bike is recommended . Love for royal enfield deep inside my heart...:)
267,5,It is very comfortable ...You can use it for long journey but don't think it is sporty But it will give you more comfort. I have bought it 2 yr before everything is ok only sometimes i feel top seed should be increased.At the service center there are trained staff you will not face any problem Maintenance of bike is little bit high but not as much so that you cant afford.
268,5,It is awesome bike in look. Mileage is very good about 33-37 km per liter.When u ride its feels like u r king of road.Balance of bike is very good. It has good power on sloppy road. Look is fantastic.Also there are many accessories available in market to change the look of your bike. Lights and alloy wheels and many more. Over all is very good. It has mettle body.
269,5,"Not yet bought but planing for that.....Riding is amazing feeling like royal.... Looks stunning, beauty , amaze, 10 out of 10 on looks...Performance is remarkable without any doubt..... Service is amazing and maintains is affordable....Eager to buy in very short period...Any how...I am dr. by profession but not hesitate to drive royal without any doubt..."
