ID,Rating,clean_review
109,1,"If you want to use belt on your Spine in your young age you should definitely go for a Royal Enfield Classic generator.. There is no word called repair for the RE mechanics only replace. No perfect fuel indicator till now. No led set up. Less power. Only good thing is - made off of metal . One word- Bakwass invention which plays with costumer's feelings,money and patience."
110,5,"Buying experience is excited to see classic 350. Riding experience is so good Good looking and best m best performance. The royal enfield classic 350 recently received a range of official accessories to improve usability and also to enhance its looks. They include alloy wheels, knuckle guards, luggage racks and a headlight guard. These add-ons come with a 2-year warranty as standard."
111,1,"Engine performance, fuel economy and gearbox  engine noises - i have been hearing some weird noises from engine since day 1. The technicians from royal enfield say the noises will disappear as i put on more and more kms in the odo meter. Currently the odo reading is 4200kms and i don't know how many more kms i have put on the odo to make the noises disappear. Also i have been hearing some knocking sound from primary chain case, to which royal enfield doesn't have any solution.  Ride quality & handling  vehicle wobbling - royal enfield technicians worked on this issue for couple of months and till now they don't have any concrete solution for this. Technicians did all kinds of things - truing, checking vertical bends, checking horizontal bends etc. But to no avail.  Vibrations - i experience severe vibrations while riding around 80kmph. Literally i find it difficult to hold the handle. Till now no solution is provided for this issue.  Rear fender rubbing against rear tyre - i have been experiencing this since"
112,5,"I was born in a middle class family but my bike made me royal this is the first thing i want to share with you then all vehicles have it's own merits and demerits bit in my case i also do some mistakes in my home so i don't think about that failures for all it is a engine buy for me it's my heart i love my bike the major feel i get this bike is it's dug dug dug sound and that vibration and the weight my bike also love me because she don't put me down even long rides.She is ready to pic me everywhere in this world, the look is so amazing and the service and maintenance cost is low, all can manage it i Love my bike and i'm thankful to the marikar showroom kollam."
113,4,"Its very decent bike to buy got a mileage in city is 38 and highway 45. Royal look seating is very comfort heavy weight of bike as my height is 6'1 tall riders it is very good abs performance is good very cheap maintaining bike compared to this 350 cc segment. Mine is redditch red, it way looks is better."
114,5,"Royal enfield as a brand i really feel like royal comfort with royal performance. I had ride many bikes like hero,bajaj and tvs but when i purchased the royal enfield bike it makes my choice a little bit different it provides me really a royal look. When i ride it ,i am amazed with it's performance. It's runs as smooth as a gel pen on paper. I am from town area where the roads are toughest challenge for any bike to show there performance. But with my royal enfield 350 it is not a big it runs smoothly on roads as well as field."
115,1,"I used this bike from 4 year for my daily routine Every parts of RE are to expensive n cheap quality High maintenance bike have to much vibration after 90kmph and RE Service centre it's not familiar they are not well trained most of them are irresponsible if your budget is 2lakh better to go for Dominar,Mojo,KTM now am a proud owner of Dominar it's really Worth it..."
116,5,"Be royal only on royal enfield an amazing bike i liked it is best and comfortable for family , student and mainly it is comfortable sitting behind the bike for senior citizens and royal enfield classic proved to be my desire fulfilling bike. I choose royal enfield because of its elegant design, performance, engine thump and all above its royal legacy which has been carried out for decades. Though, I had other options as well but i preferred choosing the beast over the goats. It has tremendous style possessing the macho feel as while riding you don't feel like riding a regular one because u are on the beast. As far as performance and mileage is concerned, i can take out a 40+ average even in city traffic. The bike feels a little bulky and clutch stiffens once hands get pain in the traffic for the initial rider. So you can't complain, because if you are complaining then it's like asking a beast to treat you gently. Hence for me, it's not a big deal. I have been using this machine for more than 5 months and rod"
117,4,"Well, this is a well-known motor bike in our country. Not much to say about it though. But here is a very basic review from a automobile enthusiast. This is my second re bike after machismo during my college days.I use it mostly for in-town riding (not daily commute) and for long rides or trips. This is a nice bike to own considering the price point. Now if you want more then you need to pay more. So don't crib about it. Ride quality and handling is good and you will love it if you take it on a long spin. (the pillion rider seat can be improved)Coming to the looks, riding pleasure and mechanisms - they are decent. Re is adding on new features as well on a timely basis.Now the buying experience and after sales service for re bikes in general. Here, in this space, i find there is a lot of room and scope for improvement. It could be ironed out keeping in mind the real good service quality and customer friendly attitude : ) After all, the service quality is an integral part of the entire automobile manufacturing"
118,5,Pros :- (1) it is good in mileage of 43kmpl.  (2) when you ride it feels like awesome.  (3) it gives you class  (4) its looks are just fantastic  Cons :- (1) the only problem is their is no fuel meter (indicator) so you have to put petrol when it comes to reserve mode.  Summary - best buy for all bike lovers its just awesome must buy
119,4,Buying experience was not that good enough because in silchar classic 350 is in high demand so you have to wait (q) .While riding i feel like i am the one an only boss on the road.Looks that i don't need to say everybody knows that very well. (awesome) while i ride the bike near market area everybody stare at me and my bike.Performance is at its best One an only cons is fuel efficiency. But due to 350cc engine you can't see that as a cons.
120,5,My father bought it for me from Raghu Ram Auto Care . The buying experience was really good everyone talked very nicely and cooperated very well. I would like to start from the pros.- 1. Very Eye catchy. 2. Very smooth ride and comfortable as I am 6 feet . 3. Gives a great mileage if ran smoothly. The max I got is 47 km/l. 4. Balance. 5. Power. It could move in hills to Rocky areas very smoothly. Con- 1. I don't recommend it for short height people as at times they get misbalanced . But they can buy if they really want to. 2. Weight. ( It's a pro also) 3. Brakes. I felt the sandstone model has got better brakes.
121,5,First i was a bit confused between royal enfield and r15. But after getting a test drive i got to know the comfort level of this bike. It tops all other bikes in its range. In fact the best cruiser bike on its range. Its engine power is insane. Despite being a 350cc it gives an amazing mileage. The only con it has is in its look. Because the look has not changed since long.
122,5,"It's a low-cost complete packaged bike which delivers passion and style with its owners itself , design in better , performance is good ,low maintenance and good for riding for long drive specially for mountains ,better controls ,super smooth and very stylish , now a days it's a common bike for youths .Need to do something about silences and fuel injector system of bike ,rest everything is ok, i am a owner of classic 500 and 350 desert storm . And i am loving it ."
123,1,"I had to wait for 6 month for delivery, even after paying 1.5lac showroom people hardly seem supportive. Riding is good, just keep spare clutch and accelerator wire as they tend to brake regardless of road condition. Service centre those are maintained by re are worst place to repair your bike, if you have option of independent service always go to that place instead of re service centre as post service one more trip to service centre is compulsory and they will make sure that your working parts should also stop working. Pros: legacy (not aware how long it will continue)Cons: service, spare parts, and extremely high cost to ownership."
124,4,"1.Buying experience of these bike excellent as compared to other bikes we have to wait for at least two months and if we early it is good.2.When riding an bullet you feel like royal ,king and the experience feel we are getting is too good it is like emotion more than enough.3.Looks like gunman and royal look4.This not bad.5.Pros -seating position is more comfortable, royal look, exhaust sound thumb cons-vibrations at higher speed, mileage, weight is on heavier side."
125,2,"Style  its really looks sexy .  Engine performance, fuel economy and gearbox  the engine performance is ok. Fuel economy is good and gearbox is worst. Every time when i change ma gear i hear some weird sound from it. Some time the gear doesnt shif properly only. Even the service centres in bangalore are really pathethic. They dont know how to service the bike properly. But charge a huge lumpsum amount. I have asked the garage felow to sort out the problem of my gear box and still he is not interested in listening and he postponds the service date.  Ride quality & handling  the quality of ride is pretty good but when the bike crosses 80kmph it vibrates a lot creating a numb feeling in the hands. Also pillon riders find it difficult to sit as the comfortness is really poor. When it comes to thehandling it is quite good.  Final words  royal enifield has to do a lot of research in solving the problems related to gear box, chain as well as handle vibration. And please dont manufacture a bike in sake of making mon"
126,3,The vintage style is perfectly masculine comfortable for even long distances however there are fields were lot of developments are in tyre need of like the clutch (there is always some issue with clutch resulting in bad gear shifts )Next issue with the bike is it’s top speed it take enough time to cross 100 km/hr and if ever it crosses 100 mark there is a lot of annoying vibration going in the bike.
127,1,"Delivery is too late. They have gave delivery date after booking the bike no response from showroom that when we get bike. Not at all received calls also.. Bike is good but the sales people are very irresponsible. We are not happy with the showroom, bad name for royal enfield cause of the sales persons."
128,1,"1. Its ok ok. 2. Riding is good but vibration is too high.3. Looks good4. Servicing and maintenance cost is too much. In every service they say this you have to refit or change it. The labour cost is too high. Once I serviced they count 2600rs. Only for labour cost. If they fit new clutch wire they claim total cost of 250 rs. Approx. In that the wire cost is 150 rs. And labour cost they count 100rs. (for example). I spent 50,000+ in five years service. 5. Never buy this bike. Worst experience ever. Go for jawa its nice bike."
129,5,This is the best bike i have ever seen.Its engine and look is unbelievable. I am very interested in this bike.It has excellent brakes.Its voice dug dug is best one.All bikes are just like cat in front of this.I will understand this bike.I recommend all friends to buy this bike and enjoy life and thrill in adventure.
130,5,"I have a bs3 classic 350, its original thump is nice to hear. Then i changed to short bottle silencer which sounds like vintage bullet and the performance is good, mileage also decent but the bs6 bullets are totally disappointed. the dug dug beat is missing in bs6 bullets and the bhp is reduced...Bs3 &bs4 bullets are ruling the roads.. my brother having 1985 model bullet such a chopper..addictive beat but the mileage is 28kms then the top speed is not impressive and that's why i am owned bs3 bullet."
131,5,"When you planning to buy this beauty you should not consider its cost, this machine is fabulous in all colours. This machine is designed for long tour especially.Attractive design with good performance. I don't find cons in this machine except it's sitting posture, but it's sitting posture makes you feel you owned something beautiful.If anybody plans to buy new one,i would suggest to go for bullet instead some plastic or fiber."
132,1,"I own 2015 classic 350 and i've been regretting that decision for a long time now. The main reason is that re bikes are not for everyone cause every person has different taste in bikes but ends buying an re because of it's thump and retro looks, that's the major mistake they'll make and ends up regretting it.Major issues are: 1. Vibrations - oh man you can't get rid of it and it's starts when the engine is on. The mirrors are useless because you can't see anything cause of vibrations. I changed my stock mirrors three times! because the mirror get broken of vibrations.2. Maintenance- average cost of 2500 is spent for every service which is costly considering it rivals. Once i didn't ride my bike for a month and got some problems when it came back from service the bill was for 8000 !!! my 2018 maruti dzire got serviced last week and the bill was less than 6k, considering this it's absolute waste of money to spend it on re. 3. Mileage - i get average of 32-35 on city and highway. 4. Highway - you can't go above"
133,5,"This is really an amazing beast. On road it is like a beast and other two wheelers gets aside just listening after the voice. While riding it feels like i am the bond.Grip on road, speed is furious and very good control on road. People know you by your enfield. Really amazing and 5 stars to this beast.My best choice by selecting this beast."
134,5,Its very easy to buying... I have ride so many bikes. Make me proud we can not explain the feelings in words while ride with my bullet. I had ridden from noida to manali.. It was a great trip some of the bikes are dump in between the trip but my royal was cross the limits.
135,5,This bike is a very good for long ride bike seat is very good and comfortable this maximum speed is goes to 140 km and the mileage is 37 km i will also suggest you to buy this bike and the minimum emi in India is 15572 rs to all you should take this bike and is look good this bike is very good thank you.
136,5,Classic 350 is not the bike who will take speed of 100kmph in just 5 second it keeps you safe.You will experience a amazing riding with with royal touch..It's not the expansive than its feeling.Very suitable for long drive and..Now the self start feature is very useful.This is not a bike this is a member of my family .
137,3,"What we get in 1.6 lakh ? tube tyre which we get difficulties when there is puncture while touring! no fuel indicator! noisy engine after 1-2 yrs! rusting issue! is it worth buying re ? just for looks and feelings? re should think about people, what they expect in 1.6 lakh rupees, look into this..."
138,2,Royal enfield is a brand but now this brand in only in name. I have classic 350 and this bike is not very good. One way problem is a very serious problem in this bike. Carburetor which uses in royal enfield is of bajaj pulsar 150cc. Self problem is also in royal enfield classic 350 model.But it has muscular look which only attract people to bye enfield otherwise nothing good in new royal enfield models
139,5,"1.Engine is very powerful upto 95kmph And comfort is good upto 100kmph speed.2.Seat comfortable for long rides easily .3. Mileage is amazing for that high cc engine its 40kmpl ,if you travel in 80kmph and 35kmpl for 90 and above speed.4.Head lamp is simply classic and high power lamp Instrument cluster is simple and little more increased 5.Nice breaking in new versions with abs system."
140,1,"Style  nice in style and looks  engine performance, fuel economy and gearbox  very bad engine value and gearbox. Parts getting break down very soon. Fuel economy is efficient  ride quality & handling  fine. Nice for long rides infact. But not like thinderbird  final words  go for standard instead. Or buy old bikes not new. Old bullets are quite long lasting and good in quality spare parts.  Areas of improvement  their engine parts quality getting lowered by days. High maintenance cost for everything. Genuine parts are available at sky high price. Local parts not available.  Pros  royal enfield brand  cons  engine quality, parts quality"
141,2,Worst ever service ever received from royal enfield as well as dealer  yamuna agencies adoor kerala  . I have contacted to book re 350 chestnut and received a confirmation as they have stock of that color and can be delivered within 2 weeks .I am ready to pay 50k as initial and balance as finance so i paid 5000rs as advance and after 2 days after the approval of finance they called me for the balance payment of 45000rs .After all the payment they are not calling back and not answering the calls .Everywhere managers are to solve the problems but in this place no hope from the that person also. Near to 1 month i received the bike ( 17/06/2019) and until now i didn't received my no plate . I raised this issue to re also and the response is worst than dealer. Still i am waiting for response from anyone.Worst worst service from re agencies.
142,5,I saw lot of negative reviews above yes of course royal enfield too has pros and cons but if u want the royal enfield to be like duke its not possible this is classic that is streets what i am going to say is choose the bike according to u r physical personality royal enfiled are need a good care and maintenance its not meant for fast ride the comfort its the main motto so if u want your ride to be comfortable smooth then go for royal enfield its one of the amazing bike for indian roads and more features compered to harley with less price . The company is there for more than 50 years and had set lots of record in riding and also world record in stunts so i am very happy to be a rider of royal enfield made like a gun.
143,3,This bike is a nice option for casual use and for fun rides but its heavy weight sometimes becomes a problem for daily commute because its very difficult for a daily commuter to handle such a heavy bike as it can be very tiring for a person to handle a 200 kg bike.I bought it for my daily usage but its heavy weight is now becoming a problem for me.
144,5,Best bike for daily commute. But not a good bike for rainy season. My bike has too many problems. When you fill petrol more than 400 rupees the bike doesn't start and run well. I had brake issues too. For no reason the brake will not work properly. When you park your bike in rain means the water will enter your bike's ignition wire and the bike won't start . It tools nearly more time thank you think to start over the bike again in rainy days. Bike just needs many improvement in many aspects. But for a middle class family i don't suggest this bike. Buy a good bike.
145,1,"I have purchased royal enfield classic-350 efi- gun metal grey bs6 engine bike on 19/01/2020 from north delhi motorcycles-520. I am so happy that finally i have purchased my dream bike which have planned last 2 years. But unfortunately, i have faced so many problems in few days:-Clutch plate damage after running only 129 km. silencer color change to abnormal- change to dark red and brown color. lose wiring issues, horn was not working while driving.Pickup issue-due to clutch problem in bike. gear problem- while changing gear it stuck most of the times. while running 1-2 km, silencer over heated as compare to other same modal bike. So it is sign of over heating of engine. Which may occur major problem in bike. Engine overheating & thus engine seizure symptoms are there.I completely shock that all above problems come in my new bike which run only 129 km. Being royal enfield a big brand, company always promised to satisfy the customers in sense of durability and comfort. Whereas i am not satisfied and my trust"
146,5,"I bought royal enfield classic-350 after overall wait of 1 month from the booking date. Mine one year ownership is awesome only with slight general repairs. When my odo turned 15,000km i got my service billing amount around 6,000 that’s the only thing i felt bad! except the maintenance charges bike is awesome!  Handle moment and vibration must be manage a little more"
147,5,"1 very good experience while buying the bike 2 best bike for riding 3 best bike in world for looks and performance 4 everyone is helpful while servicing and maintenance in service center and do there work properly5 there is no disadvantage of this bike, it is the best bike in the world with lots of advantages."
148,5,"Ride ability High torque at low rpm means maximum pulling power from low revolutions, making a ride uphill or your daily commute effortless.In the classic, heritage and time-tested performance go hand in hand. Its dashing, vintage-inspired looks are underscored by an enfield trademark - dependability.The classic is a machine you can count on, come hill, dale or plain. It has the torque to flatten mountains and persevere through entire ranges.Ride home the royal enfield classic with emi starting as low as inr 2,490* per lakh. Avail exciting exchange offers on your old motorcycle."
149,5,"I take her for trekking and night camps, she never got a scratch and always was comfortable to go on rocky mountains and bumpy roads.As named its a classic. Doesn't require much maintenance even after so rough usage.Its heavy yet the most powerful vehicle to take anywhere on any road with less effort."
150,5,Best mileage and maintenance is very costly and material quality is very best classic 350 and break system is best all good quality is best in royal infield bullet is powerful vehicle and very best and very good looking so much and riding and handling quality is best and almost everything looks nice.
151,1,Ahh! no pros. Started facing issue from the first month. In comparison to other 2 wheeler it is worst bike. 20th century old technology with bugger service and service centre. If you want to waste your money den buy this bike. I bought it in Feb 2018 and it was the start of never ending story to go to service centre.
152,1,"Today (01.01.2018) while driving my royal enfield bike's chain sprockets broken suddenly, just escaped from a major accident.  When i contacted the royal enfield showroom, they are very much irresponsible and casually saying that these are not covered under warranty.  There is no where my mistake in this, as it is a new bike not more than 8 months old, and just crossed 12000 kms.  I have all the necessary documents also up to date service done at the showroom still , its suddenly broken when i'm on road in 60 kms speed, if something happened to me then who will be responsible.  Chain sprockets seems to be of very poor in quality , if not then how it will get broken in this much short period of time.  I was a proud owner of royal en-field and now feeling shame because on the quality and the way of response from the showroom.  Company should take the responsibility for this as we are trusting and investing so much of money , and is it to get such a cheap quality product"
153,5,"Hi!! every one this is worth information to all who wants to buy royal enfield classic 350 it is one of the best bike for the Indian roads as i enjoyed comfort, style, road grip and even more love u bullet and one more thing i would like to say is for Indian pot hole, humps and kaccha road traffic this is the best one guy please say yes to royal enfeild"
154,5,"It's a very good bike i like this it's my dream bike how long u can ride this royal enfield no back pain and no stress, it's very good bike this bike is long drive very good for as and this is royal bike, i like and i love this royal enfield bike last two years am using this it's very good i love this."
155,5,"I bought classic 350 in 2015 ash colour After riding 16,000km in 5 years It’s really good bike It gives such a feeling while riding The vibration of this bike only gives little very Apart from that really well Mileage around 35 to 40 km i getting for normal roads. In hill station it gives massive feeling to ride the bike Apart from vibrant everything is good I used to go for college in this bike weekly twice."
156,5,I purchased gun metal 350 classic it looks like a bullet coming from the gun and while riding the bike it feels like sitting on the elephant and having ride and its cost is also avarage 1.80k. I had a ride in mountains and in sand it will never get struck and gives smooth ride. And bike speed also very good in bs 3 while speeding the bike it will get vibrate but in bs 4 it will never get vibrate. I will never feel bore on this bike good servicing but it cost more for oil changing and some repair while getting for service.
157,5,"Really, it is enjoyable to ride. It makes me feel that i am being seen and respected. It is fabulous smooth to ride. I have never got tired by riding. It make me feel that i have a great asset. Where ever i go i am being attracted and inquired about it so i could feel i have something special in me and good decision maker.Really i am very proud of having it.Thank you."
