ID,Rating,clean_review
270,5,The bike is just amazing. As it runs smoothly and so far there isn't any problem. Since i have bought a couple of vehicles throughout past few years this has been the best. The bike is comfortable and the road grip of the bike is fabulous. Maintenance ans service is average if you maintain and drive the bike in proper manner.
271,4,It is good bike for daily commuting in city. The mileage of the bike is decent. It is not that much comfortable so not for the one who wants to use it for long rides. Vibrations is the major cons of royal enfield bikes. The maintenance cost is also higher compare to other bikes of same class. It fetch you that value for money as u expect.
272,5,"Hi friends, my one friend has this bike i once drove this bike i felt so happy and i was just feeling very happy and confused that it was a bike or a cloud It was just gorgeous and i felt that i cannot control my self a some tears also came I was a royal enfield user before 20 years but these years i was riding different bikes And re has refined its engine also."
273,4,1 ) royal enfield classic 350 you will get a very best experience and many varieties of colours. 2) my personal riding experience is awesome the brakes are good enough with gripped tyres. 3) performance is very good.4) you have to do maintenance and care a lot. 5)if you are a bullet lover then buy now.
274,5,One of the best bike i have ever bought riding it from past 2 year and don't have much problem . I just do regular service at 3000 kms and fill fuel nothing else no problem or any huge maintenance costs just buy it no problem but only if you can take care if this beast and i easily gets mileage of 35-40 in city which is good enough.
275,5,Awesome experience..Best bike yet..and love it...Smooth riding..Smooth performance..And mileage is superb according to heavy engine and comfort is awesome overall it is the best bike for youth and don't be confuse within choices of royal enfield and others bike..Always go for royal enfield..And am sure you love it.
276,5,"It was a great experience by riding royal enfield bullet classic 350. I used to ride occasionally but the experience was good, one can buy royal enfield for their pleasure rides. There are many vibrant colours available and every colour has its different image...I loved all colours so go and ride this lovely royal enfield.Thank you."
277,5,Royal enfield such a massive bike going on enfield is not just a fun but a royalty like its name enfield.  I am using classic 350 the fuel efficiency of my bike is awesome. So suggest everyone to pick this up.  I am so proud to be the owner of an enfield which is a brand since earlier time. So feel the royal on enfield.
278,5,One of dream bike when i ride it i feel that separate pride love my re. It was a big dream to me to buy a re after i buy i can’t believe that i have also got such a awesome bike it’s not just a bike it’s my partner which saves my time i just love it before buying it i used to see everyone who rides re in road i keep on seeing till that bike goes but now i have my own re i can’t believe it thank you.
279,5,1. Good buying experience and good seller 2. Riding experience is excellent because the bike stick on road and carry forward and don't fell the bick is heavy3. Looks and performance vije i lover of this bike this bike is my second love4.This bike bike maintenance and service i don't know because my bike 1 st service is tomorrow 5. I don't know pros and cons yet.
280,5,"Looking like a rajput bike and actually felling the riding of bike. Easy maintenance with no huge amount of servicing charge. Very comfortable in riding the bike.  i am always prefer bullet.  I am always advice to purchase the royal enfield to my friends ,relatives and other also.  One thing if their will be the digital meter ,then its good."
281,5,Buying experience is very good. Riding experience also is very good because it is to fide and pavillion are easy to long route seat.Mileage is low but its ok because i am a bullet lover but its disappointment to tubeless tyre is not giving to customer its tube tyre. Service and maintenance is good. Good look.
282,5,This is a cool bike in case of looks already but the drag in it is low as it have a 350cc engine.This bike is very good for touring and road trip but in traffic this is not a bike you should rely on. Every year same components with new colours are available.This bike is make of good product that's good but optimisation is important.
283,5,"Good braking system and good pick up for highway rides and also good mileage at highway rides, in city also it was satisfied, it have a good horse power and gearing system also very perfect it was an awesome bike that i have used showroom service also very satisfied when it was moving feels like an awesome ride that we have"
284,4,"Good ride. The problems that I had to face is, the parking lights/ eyes, stopped working just after 3-4 months if purchase. The oxygen sensor also got a bit rusty. Bought this ride as it was like a dream for me.. just like anyone else. All I can say is, you will definitely get some better bikes in this given range.. but if you are into old school stuff and obsessed with RE you should go for it. However, there are many better options in this range. PS- apart from issues with the bike the main issue is (out here in kolkata) the staff.. the people from service center are a bit weird. But no matter what, at the end of the day, I am one of those typical guys who grew up watching this tough old beast. So am still happy anyway."
285,5,Best bike compared to mileage and best for daily commuter best royal enfield bike and very affordable and the bike best balancing compared to other similar segment bikes but it is very fun the seating and riding position is the best in my opinion the speed upto 80 kmperhr is ok but above 80 it has lots of vibration.
286,3,"If you are a type of twisting throttles ,racing with other fellow riders ,cornering lover and all don't choose the classic 350 . The bike vibrates a lot above 90km/hr..If you are a guy of pleasant riding experiences ,long cool rides you can choose this one ..The braking is also not perfect climbing a hill and all you will know the power of classic 350 but i will tell you again won't feel good to youngsters who loves cornering and all.. Otherwise for peaceful riding the classic is good"
287,5,"I was so much excited that time when i went showroom with my dad to buy this freaking awesome bike And the moment when i was coming home with my new bike is really beautiful and unforgettable that day it was raining heavily 29 Sept. Its look is enough to steal the hearts of Yeah, its maintenance charges are little bit high as comparability others but its riding experience is far better. The pros are its such a hunk that could boost one's personality, Sorry no cons as of now, i love it so much."
288,3,"The dealer did a good part in giving timely delivery. For daily commute it is awesome on city roads can be manoeuvred easily, has good cornering ability in spite of its weight and you don't feel tired at all. Fuel efficiency is also fairly good. I get 35 - 40. Coming to speed part, the sweet spot is 65-70kmph. At 80 you will feel slight vibrations which are manageable. At 85 plus The vibrations become significant and it is not safe to ride this bike at above 80 except on straight highways. I have clocked 110kmph when i rode with the wind and the vibrations were so intense that even a minor bump on road would have thrown me off. Braking is another dangerous aspect about this bike . On one occasion i had to brake hard at about 65kmph and 5th gear , first rear and after a fraction of a second, front brake too. The bike skidded and fell to the right. I was lucky to wear a thick jeans that day which saved my leg from burning under the silencer as the leg was stuck under it for more than a second.You have to get h"
289,5,"So easy to buy It's available on emi Riding a bullet is like riding your passion, you will feel like a king.Beast look, smooth working.Less maintenance and strong enough for the bad roads.Comfortable and ultimate balance.I will recommend those who love riding bikes, for their pleasure... Royal enfield makes you royal."
290,5,"Ultimate bike, i just love royal enfield specially the voice, the power of this bike, balancing everything , i have travelled a lot on this bike, we have a gang of 9 friends all of them have royal enfield classic 350, we all go around on weekend for a long drive with complete safety like helmet guards etc"
291,5,"I went many long drive with my friends And we just enjoyed ridding royal ... It was a good choice of me and am satisfied with it full of my heart. Its a different feeling Everything different Its hard to explain of No other bike gives such feelings , i had gone with my wife and she too felt lot comfortable and more good than other bikes."
292,5,I like ride with my love means my royal enfield because this is very nice perform in all side. I love my angel.Bullet bike suspension is more like it.And this bike is mostly people use in long drive because it it give a nice performance in hills and any roads that is good for any other bikes.So i am advise all riders take a royal enfield and enjoy your long drive save memorable points.
293,5,I'm in love with this bike from the very first day when i bought this. While riding it just feel like a superstar. Good handling with good comfort on riding. Looks is awesome. Servicing from company authorized dealer only. After servicing it will like you are flying. Till today no problem with bike. Just buy it and you will feel like a king of road.
294,5,"It was my childhood dream to own a royal enfield and i have make it true. Earlier it was not but now its easy to get the bike delivered quickly. When you think a royal enfield it means that you don't think of speed and updated technology, what you think is the dug-dug. The colour variations and look in present day are just dope.Servicing of the bike is easy as most of the shops know it.My enfield gives the mileage of 40. The speed is enough for me but sometimes on highway or speedrun it feels a little low when it comes to get more faster. The only problem is that its increasing popularity and reach of people is leading in blunders modifications and also the poor exhaust and their pathakas. I think a classic should be kept as classic as it can. Overall i must suggest you the bike if you are touring lover, a vintage lover rider or a old school lover."
295,2,"Bs4 is really bad compared to bs4  Self start is not working properly , so many noises while driving, mileage also bad 29 kmpl in city , 34 in outer , kick start is ok , bs3 is better i think , my brother owned bs3 good to drive and maintain is easy  Always remember to check the battery box. All re bikes key is working in any bike battery box , always check that"
296,5,Awesome riding experience i love to take long drives on royal enfield. It looks great it's like a machine gun. The most love is the comfort and royalty when riding bike. The sound of bullet is like a machine gun.One suggestion to royal enfield please try to provide a good sounds silencer with bike .
297,5,Comfortable bike and right to rajputana 1 very helpful customer service 2 a smooth riding and riding 3 looking for singam performance is very good excellent fabulous superb unbelievable 4 sweet talking dealer very good service in service provider and low maintenance engine performance is very good and fast fasted bike in the world 5 number 1 bike kings of the bike segment royal enfield.
298,5,I had bought the bike around 3 years ago the bike is literally the best .... When u ride the bike u will enjoy it feels so comfortable riding it. Looks though no comparison with any other vehicle that metallic look it's strong ... Servicing and maintenance is also good there r lots of service centers available. It's very suitable for long drives and there won't be any difficulty in driving it . I prefer everyone to buy that if they want to buy a good vehicle....
299,5,"I have use the royal enfield classic 350cc,it is actually amazing. What is so special is the feel, u get the feel of royalty. Its really cool bike. Including over performances, price, mileage and etc. Its really good and i advice the viewers to use it once and then you'll get to know it well.Even the maintenance cost is also affordable... Over all performance an is great.."
300,5,"Wonderful look...Best experience for long distance riding....... This bike is best adventure bike in under 200000 rupees.....Royal enfield is low cost maintenance bike because , one time servicing in a year, servicing cost are under budget , i mean low servicing cost. Bullet just not a bike is a machine."
301,4,"Only delivering takes time, But patience is the key. Royal enfield has been great all the time. Feels so good to ride. We all know it was made like a gun and that's true. It's almost been a year, no repairs so far and serviced thrice however it is hard to push when bike is out of fuel or doesn't start."
302,4,Royal enfield classic 350 is a affordable cruising bike with a great mileage of approximately 35 to 40 kmpl. Classic is a very well customization bike good for touring. With pillion removed this bike looks like a bobber which is quite stunning. cons is basically its maintenance should be quite often. Due to its vibration some nuts may loosen which needs to be checked and serviced time to time.
303,5,This is a superb bike for me . My experience with classic 350 is awesome. This is my dream bike so i purchase that . Classic 350 is always with me on every ride. It has low maintenance. If i want to talk about its looks so i have no word s to say about this . Looks and performance of this bike is superior quality and awesome.
304,4,"I was being passionate of buying my own beast and for that, the well known beast is #royalenfield#classic#350 that i owned  It gives you a awesome ride and a royal look to yourself, yeah this beast is also comfy and nice to ride. Yep this one is heavy to .However maintaining this bike or any of the other bikes is depending on your passion on it and this needs a certain extra watch on it. But by servicing it could be a superb one . This one is a bit heavy so on the ride feels you a great look pickup wise is good for this beast, long rides are mostly loved and suited for this. However this one #royalenfield#classic#350 is made for luxurious ride and maintaining it will give a nice and comfy ride....!!"
305,5,"Amazing bike, just like dream come true i love the ride every day any time this bike is world no 1 bike so please go on grab it as soon as possible bike sound is amazing. It run very smoothly on road. For long trips it so comfortable and and give feels like royal so why are waiting go and check out fast Knocking of this bike is like you are in helicopter."
306,5,"Riding experience is awesome. It's a great pleasure to see this bike and its look is marvellous, i am very excited to have bullet like that only. It's a very good experience and you found it that this is the best way of achieving this bike as soon as possible because i am a very passionate about bikes ..."
307,4,The perfect riding companion for a every rider.For every trip it may pong or short its good enough than any other likes in market.  Its feel like raiding a bull... Everyone looks at you when raiding through roads.. Sound is like big story comes following.. And its look also great to attract everyone
308,5,"When i was buying this bike the cost was 1,76,000 and it is bs-4 engine.When we are going to any long drive there will be no pains nothing the journey will be very smooth.The looks and finishing of bike is excellent while coming to the performance there will be no complaint about bike. Their servicing cost will be after 4th service 1600 and maintenance is depends on us.The mileage is 36 kmpl in local when i am going to long drives it is giving 46 kmpl. Pros:1)extraordinary look 2)comfort driving."
309,5,It should very comfort to long journey And oil change offer 2500-3000 km. It is electric starter very easy to starting the bike. Rim wheel is looking very nice. It easy very difficult to kick starting And it servicing charge. Is expansive and it is average 40 to 45 km. It very looking bike. Its speed is very high.
310,5,"I love royal enfield. My most favourite bike is royal.I also have a gun metal gray. When i riding on my bike feel like god.This is my dream bike.And i love the royal enfield showroom.And there service. All employees are very nice and good.When training in this bike,you feel a great moment.I love this."
311,4,I use enfilade 350 classic. It's a amazing looking bike and strong than others. It gives 35 km mileage . When i ride it on 110 km / h it's not vibrate but other bikes vibrates . It's a good bike for long tour . I think 350 is good than 500 cc because 350 gives better mileage .All enfilade user feel proud because they use enfield. I am so proud . It's not a bike it's a tiger
312,4,Its very good to visit the show room....Riding is very comfortable...Its looks like a race bike so its very beautiful things when i was riding in that bike....Service is good...Maintenance is little costly.....When we are in a ride..Its looks like a racing...So its very grateful to drive this......
313,4,"This motorcycle is unique in its own way. The only drawback is the power which seems quite low considering the engine specs but that's not a problem because there are many other factors like torque,comfort,ride quality, use of metal almost everywhere and the legendary thump which makes the classic 350 an amazing motorcycle."
314,5,"Am a great fan of royal enfield. Whenever i ride this gun, will feel a wonderful experience. Comfort ability is one of the main aspect. Possibility of accident is too less as comparing to other bikes.But maintenance is one of the issue that most of the peoples are facing nowadays. Anyway my rating is 5 out of 5."
315,3,"The pros: Bike is quite sturdy. Loads of torque. Dual disk break works well. Macho feels. You can seat with youur parents unlike other bike such as dominar or ktm. Cons: Doesn't have fuel gauge, new one has i guess.Max speed you can go is 90 post which it vibes a lot. So cruise at 80-90 on highway.Opinion - if you ride fast n have gang of friend who have other bike you can't keep up with them."
316,5,"Ohhhh...... What a bike......... Sorry its not just a bike, it gives something special that ordinary bike cant give!!!thanking bikewale for getting more information about re.It gives me enough confidence on road. It enable us to feel a bike while riding this extra ordinary machine. Big salute for re."
317,5,Since childhood i have a dream to drive royal enfield my dream comes true i recommend all of my friends to buy this. Because it's not bike it's jet fighter lots love.. When my friends decide to tour i use my bullet it's awesomeness overloaded last year i have ladakh tour with my friends we use royal enfield i feel my dream comes true... Love you royal enfield.
318,5,"The buying experience is very good. Riding experience is like a heaven. Look is very sexy and cool. Servicing and maintenance is good. Oil change after you ride 3000 and maintain your bike performance. It is a rocket which launch in roads so sexy look, it's give you a unique personality and look when you ride this."
319,5,I bought this bike this year only from their official showroom. I had to wait for 2 days as this bike is in high demand. But it was totally worth it. Riding it feels like i am the king of roads. The feeling is incomparable. The front dial gives you raajgaddi type experience and it is really comfortable too. Rest 350cc is more than enough for Indian city roads and i never felt even a bit of problem taking it hilly areas too. I say go for this bike if you have a passion for vintage plus bold and strong things. And obviously swag comes along.
320,5,Classic 350 is not the bike who will take speed of 100kmph in just 5 second it keeps you safe.You will experience a amazing riding with with royal touch..It's not the expansive than its feeling.Very suitable for long drive and..Now the self start feature is very useful.This is not a bike this is a member of my family .It is a very good bike with good riding comfort .
321,5,"I purchased royal enfield 350 cc classic in 2018 & used now my memorable experiences.Good bike...Never had a serious problem with the bike..And ya....It really gives u royal feeling...Mileage maximum i got on highway is 52kmpl..But it varies a lot according to your riding(but never below 42kmpl).Performance isn’t as fascinating as one would expect from a bike belonging to re clan. Unfortunately, the 350cc engine lacks punch and the hefty weight plays against it restricting bike’s ride quality. Thunderbird 350 shows signs of discomfort when cruised above 90 kmph. As per royal enfield’s word, thunderbird 350 can deliver 23 kmpl of fuel economy which is way too less as compared to competitors in the segment. Everything is best."
322,5,Its a best bike and comfortable  It has a good suspension.  It gives us a best experience of riding the bike.  If you want to buy a classic 350 its your best decision as it is a different and heavy as compared to other bikes  And if you want to feel how the riders feel you must buy this bike.You will never feel guilty by purchasing this bike.
323,5,Royal enfield classic gun metal grey is the top most rated and it looks very stylish and must use company silencer for better mileage and use tubeless tyres for long rides and fill nitrogen air only.Must and should use helmet and double seat for more comfort.Regular servicing is required at-least once per month.
324,5,M a madly into royal enfield.. Specially your military colour.. As the part of force member.. We already having royal enfield in our campus.. So whenever i need to travel in border area i always prefer royal enfield instead of our maruti gypsy.. As you already border roads are rarely maintained and some of our border out post is in heel area.. So normally bike needs power and comfort.. And all these qualities given by royal enfield classic with their hercules look.. As we having already a branch of vehicles so servicing and maintenance is not an issue.. Now i am planning to buy same bike for myself so that whenever i will go to leave.. I will ride my own #royalenfieldclassic350.
325,5,This bike is awesome in riding and the comfort of riding in slow speed is too good.And second thing is sound that are mind blowing. I love that sound that's why it's called my dug dug dug. I Want to buy second bike as it is same because i can't use another bike as a enfield...Royal enfield family are very happy with this bike.
326,5,I had an extraordinary experience with my bike ... Really feeling very happy to buy it ... It has an amazing look and bitter truth that it has an powerful performance ... I had only one service with it because it doesn't gave me any fault ... I have waited since 2-3 years for it and had this heaven re.
327,4,"Style & looks: 5/5  Mileage: 4/5 (considering its a 350 cc, it easily gives 30-35 kmpl)  Maintenance: 4/5 (not many problems, but don't compare it with a 150 cc daily commuter bike. You got to pay a little price for luxury)  Royal enfield classic is great mix of style and pleasure. Riders who are looking for sheer pleasure in riding should go for re. You got to respect the bike and it ride carefully. Since its heavy machine it comes with little bit of price, in terms of taking care of the bike, regular service etc. But it's all worth it, since no other bike in this segment can get you this kind of ride comfort, classic vintage looks, good mileage, decently priced."
328,5,Amazing ha handling with a confidence while at tough turf. Bike has given wings to the speed performance and best part is bike self start.The tyre’s are better with high level of grip.The single or double sitting completes the bike in all the way with the flexibility part. Average is better than what it was earlier.
329,5,"BUYING EXPERIENCE: Firstly the buying experience was good and got bike delivered within a week on exactly the day they promised to deliver. RIDING EXPERIENCE: Coming to riding experience, very happy about it no other word than 'SUPER' be will make justice for riding experience, at least for me. But I feel its not much comfortable for pillion for even the medium distance rides. LOOKS: No other bike gives you a biker identity as this, people's attention on it has reduced now a days because these bike have become more common in recent years. PERFORMANCE: Good. SERVICING AND MAINTENANCE: This is the part where it get worse maintenance is little bit costly but if you love your bike you should maintain it well with enough care, but the servicing experience is not so good at service centers. Pros: Looks Comfort And many things Cons: Servicing experience"
330,5,Nothing like royal enfield. Every company try to be like that but no one can compete royal enfield. It is amazing bike with super sound therapy.Only those can understand who had ridden it.I like it's vintage look as well as it's beautiful seating posture. I never ever seen such a beautiful posture in any Indian bike in this segment.
331,5,Amazing and unbelievable comfort during each ride. The classic look of the vehicle is the most attractive sector of the bike. The engine performance is immaculate and it's one of the most loved and owned vehicle by most of the youngster in India .People consider it as a pride to own a royal enfield motorcycle. Proud to be an enfielder...
